{
    "$schema": "https://json-schema.org/draft/2020-12/schema",
    "$id": "https://delta-v-beyond-sector-3-26/schema/planet",
    "title": "Planet",
    "description": "AGENTS: before modifying this schema, read AGENTS.md at the repository root.\n\nA planet template containing mesh-specific data only. Orbital parameters are defined in the world definition per entity instance.",
    "type": "object",
    "additionalProperties": false,
    "required": [
        "entity_type",
        "collision_shape",
        "bounding_box"
    ],
    "properties": {
        "entity_type": {
            "description": "Entity type discriminator. Must be 'planet'.",
            "type": "string",
            "const": "planet"
        },
        "collision_shape": {
            "description": "Collision shape for the planet. Defines how it interacts with other objects.",
            "type": "object",
            "additionalProperties": false,
            "required": [
                "type"
            ],
            "properties": {
                "type": {
                    "description": "Collision shape type. 'sphere' or 'box' are supported.",
                    "type": "string",
                    "enum": [
                        "sphere",
                        "box"
                    ]
                },
                "radius": {
                    "description": "Radius of the sphere in metres (for sphere shape type).",
                    "$ref": "https://delta-v-beyond-sector-3-26/schema/units#/$defs/length"
                },
                "half_extents": {
                    "description": "Half-extents of the box (for box shape type).",
                    "$ref": "https://delta-v-beyond-sector-3-26/schema/common#/$defs/vec3"
                },
                "offset": {
                    "description": "Offset of the box center from the mesh center (for box shape type).",
                    "$ref": "https://delta-v-beyond-sector-3-26/schema/common#/$defs/vec3"
                }
            }
        },
        "bounding_box": {
            "description": "Axis-aligned bounding box of the mesh in planet-local coordinates (metres). Computed once from glTF mesh. Used for debug axes and spatial calculations. Min and max are opposite corners of the box.",
            "type": "object",
            "additionalProperties": false,
            "required": [
                "min",
                "max"
            ],
            "properties": {
                "min": {
                    "description": "Minimum corner (x, y, z in metres).",
                    "$ref": "https://delta-v-beyond-sector-3-26/schema/common#/$defs/vec3"
                },
                "max": {
                    "description": "Maximum corner (x, y, z in metres).",
                    "$ref": "https://delta-v-beyond-sector-3-26/schema/common#/$defs/vec3"
                }
            }
        },
        "is_gravity_source": {
            "description": "If true, this body generates gravity on other entities. Planets are always gravity sources. Default: true.",
            "type": "boolean",
            "default": true
        },
        "animations_enabled": {
            "description": "If true, mesh animations (e.g., moving clouds) will be played. Default: true.",
            "type": "boolean",
            "default": true
        }
    }
}
