{
    "entity_type": "planet",
    "collision_shape": {
        "type": "sphere",
        "radius": {
            "value": 242.915,
            "unit": "m"
        }
    },
    "bounding_box": {
        "min": {
            "x": {
                "value": -242.91500743580244,
                "unit": "m"
            },
            "y": {
                "value": -242.91989691370762,
                "unit": "m"
            },
            "z": {
                "value": -242.8755840669846,
                "unit": "m"
            }
        },
        "max": {
            "x": {
                "value": 242.87509429068297,
                "unit": "m"
            },
            "y": {
                "value": 242.91520941454002,
                "unit": "m"
            },
            "z": {
                "value": 242.92257520835457,
                "unit": "m"
            }
        }
    },
    "is_gravity_source": true,
    "animations_enabled": true
}
